<?xml version="1.0" encoding="UTF-8"?>
<!ELEMENT valutazioni (valutazione*)>
<!ELEMENT valutazione (username, id_recensione, stelle)>
<!ELEMENT username (#PCDATA)>
<!ELEMENT id_recensione (#PCDATA)>
<!ELEMENT stelle (#PCDATA)>
